Entretien,Thème,Code,Verbatim,Fichier
LAU4,1: Perception de la dépendance à ChatGPT,1: Reconnaissance d'une dépendance,"Maintenant que tu le formules comme ça, peut-être qu'il y a une forme de dépendance",Lau4_segment_10.txt
LAU4,1: Perception de la dépendance à ChatGPT,2: Évolution de la perception de dépendance,parce que je ne la ressentais pas au tout début.,Lau4_segment_10.txt
LAU4,1: Perception de la dépendance à ChatGPT,3: Raison de la dépendance,parce que je m'y suis habituée et que je vois des résultats sur ma manière de travailler,Lau4_segment_10.txt
LAU4,1: Perception de la dépendance à ChatGPT,4: Impact sur le travail,Des résultats sur l'approche que j'ai face au processus de rédaction.,Lau4_segment_10.txt
LAU4,1: Perception de la dépendance à ChatGPT,5: Acceptation de la dépendance,"C'est vrai que la dépendance, c'est jamais quelque chose de positif, mais...",Lau4_segment_10.txt
LAU4,1: Perception de la dépendance à ChatGPT,6: Justification de l'usage,"Mais en sachant que ce n'est pas nécessaire, mais que c'est du confort, ça me rassure.",Lau4_segment_10.txt
LAU4,1: Perception de la dépendance à ChatGPT,7: Perception de l'aide apportée,"Oui, parce qu'au final, je sais que le travail a été... que c'est mon travail de A à Z, mais c'est vraiment la forme qui a bénéficié de cette liberté.",Lau4_segment_10.txt
LAU4,1: Perception de la dépendance à ChatGPT,8: Sentiment sur la dépendance,C'est un peu mon plan B.,Lau4_segment_10.txt
LAU4,1: Perception de la dépendance à ChatGPT,9: Usage systématique,"C'est vrai que ça devient quand même systématique, oui.",Lau4_segment_10.txt
LAU4,1: Perception de la dépendance à ChatGPT,10: Réflexion sur l'usage,"Je me dis que, c'est ce que je dis quand je parle d'être rassurée, c'est parce que je sais que je vais pouvoir l'utiliser donc j'y pense dès que je suis bloquée à ce niveau-là.",Lau4_segment_10.txt
LAU4,2: Légitimité de l'utilisation de ChatGPT dans le milieu académique,1: Perception générale de la légitimité,Pas toujours.,Lau4_segment_10.txt
LAU4,2: Légitimité de l'utilisation de ChatGPT dans le milieu académique,2: Légitimité dans certaines tâches,"Là, dans le cas de relecture et de reformulation, je trouve que c'est légitime.",Lau4_segment_10.txt
LAU4,2: Légitimité de l'utilisation de ChatGPT dans le milieu académique,3: Condition d'usage légitime,Sinon je ne l'utiliserai pas.,Lau4_segment_10.txt
LAU4,2: Légitimité de l'utilisation de ChatGPT dans le milieu académique,4: Risques d'usage illégitime,"Mais après dans le cadre d'une thèse, je pense que c'est un peu difficile, ou même dans un mémoire, c'est peut-être difficile de vraiment l'utiliser d'une manière illégitime.",Lau4_segment_10.txt
LAU4,2: Légitimité de l'utilisation de ChatGPT dans le milieu académique,5: Importance de la réflexion personnelle,Il y a de toute façon une réflexion personnelle et on ne peut pas demander à ChatGPT de...,Lau4_segment_10.txt
LAU4,2: Légitimité de l'utilisation de ChatGPT dans le milieu académique,6: Limite de l'outil,"On pourrait demander à ChatGPT de remplir... d'écrire une problématique et de rédiger à notre place, mais je pense que dans les travaux, ça pourrait devenir un peu embêtant si la personne n'a pas fait le travail de réflexion.",Lau4_segment_10.txt
LAU4,2: Légitimité de l'utilisation de ChatGPT dans le milieu académique,7: Différenciation des contextes d'usage,"Donc oui, il y a beaucoup de cas, je pense, où je trouve moins légitime d'utiliser ChatGPT",Lau4_segment_10.txt
LAU4,2: Légitimité de l'utilisation de ChatGPT dans le milieu académique,8: Légitimité pour les outils d'aide,"mais dans les cas de lecture et d'outils vraiment d'aide à la rédaction et à la relecture, je trouve que c'est légitime.",Lau4_segment_10.txt
LAU4,2: Légitimité de l'utilisation de ChatGPT dans le milieu académique,9: Conscience des implications,"je pense que c'est un peu difficile, ou même dans un mémoire, c'est peut-être difficile de vraiment l'utiliser d'une manière illégitime.",Lau4_segment_10.txt
LAU4,2: Légitimité de l'utilisation de ChatGPT dans le milieu académique,10: Réflexion éthique,Mais après dans le cadre d'une thèse...,Lau4_segment_10.txt
LAU4,3: Impact de ChatGPT sur les habitudes de travail,8: Impact sur l'autonomie,"Je sais que le travail a été... que c'est mon travail de A à Z, mais c'est vraiment la forme qui a bénéficié de cette liberté.",Lau4_segment_10.txt
LAU4,3: Impact de ChatGPT sur les habitudes de travail,9: Changement dans la façon d'aborder les difficultés,dès que je suis bloquée à ce niveau-là.,Lau4_segment_10.txt
LAU4,3: Impact de ChatGPT sur les habitudes de travail,10: Modification de l'expérience utilisateur,ça me rassure.,Lau4_segment_10.txt
LAU4,4: Usage et bénéfices de ChatGPT pour la rédaction,1: Utilisation pour la reformulation,"Notamment, disons, les reformulations.",Lau4_segment_10.txt
LAU4,4: Usage et bénéfices de ChatGPT pour la rédaction,2: Utilisation comme aide à la rédaction,"dans les cas de lecture et d'outils vraiment d'aide à la rédaction et à la relecture, je trouve que c'est légitime.",Lau4_segment_10.txt
LAU4,4: Usage et bénéfices de ChatGPT pour la rédaction,5: Impact sur la qualité du travail,mais c'est vraiment la forme qui a bénéficié de cette liberté.,Lau4_segment_10.txt
LAU4,4: Usage et bénéfices de ChatGPT pour la rédaction,6: Complémentarité avec le travail personnel,Je sais que le travail a été... que c'est mon travail de A à Z,Lau4_segment_10.txt
LAU4,4: Usage et bénéfices de ChatGPT pour la rédaction,10: Usage adaptatif,"Je me dis que, c'est ce que je dis quand je parle d'être rassurée, c'est parce que je sais que je vais pouvoir l'utiliser",Lau4_segment_10.txt
LAU4,5: Évolution de la relation avec ChatGPT,2: Habituation à l'outil,parce que je m'y suis habituée,Lau4_segment_10.txt
LAU4,5: Évolution de la relation avec ChatGPT,3: Reconnaissance de l'utilité,et que je vois des résultats sur ma manière de travailler,Lau4_segment_10.txt
LAU4,1: **Perception de ChatGPT et de Wikipédia**,1: Perception de la qualité de Wikipédia,"il me semblait que par exemple l'article de Babylone sur Wikipédia était très agréé, était rédigé par des gens qui étaient des vrais spécialistes, etc.",Lau4_segment_12.txt
LAU4,1: **Perception de ChatGPT et de Wikipédia**,2: Comparaison entre ChatGPT et Wikipédia,Je pense que c'est encore plus difficile de citer ChatGPT que Wikipédia parce qu'on n'a vraiment pas de traces.,Lau4_segment_12.txt
LAU4,1: **Perception de ChatGPT et de Wikipédia**,3: Utilisation de Wikipédia,"moi, je ne serais pas contre citer Wikipédia s'il y a des personnes précisément",Lau4_segment_12.txt
LAU4,1: **Perception de ChatGPT et de Wikipédia**,4: Fiabilité des sources,"on peut quand même avoir la trace, même si c'est anonyme, des personnes qui ont contribué à la production de la page.",Lau4_segment_12.txt
LAU4,1: **Perception de ChatGPT et de Wikipédia**,5: Préférence pour les sources traçables,"Donc de ce point de vue-là, il n'y a pas une citation possible, une seule citation possible, alors que Wikipédia, on peut quand même avoir la trace",Lau4_segment_12.txt
LAU4,1: **Perception de ChatGPT et de Wikipédia**,6: Limite de ChatGPT,c'est vraiment une synthèse de tout ce qui est disponible sur Internet.,Lau4_segment_12.txt
LAU4,1: **Perception de ChatGPT et de Wikipédia**,7: Utilisation académique,j'utiliserai pas [ChatGPT] s'il n'y a pas de référence,Lau4_segment_12.txt
LAU4,1: **Perception de ChatGPT et de Wikipédia**,8: Recherche de sources,"Après si c'est facile de retrouver sur internet, je le ferais sans doute, d'aller chercher la source.",Lau4_segment_12.txt
LAU4,1: **Perception de ChatGPT et de Wikipédia**,9: Confiance dans les sources,déjà je ne serais pas tellement en confiance,Lau4_segment_12.txt
LAU4,1: **Perception de ChatGPT et de Wikipédia**,10: Respect des règles académiques,C'est vrai que tu restes un petit peu proche des règles académiques,Lau4_segment_12.txt
LAU4,2: **Enjeux éthiques et usage de ChatGPT**,1: Problèmes éthiques liés à ChatGPT,comment est-ce que tu te positionnerais vis-à-vis de ça en termes d'enjeux éthiques,Lau4_segment_12.txt
LAU4,2: **Enjeux éthiques et usage de ChatGPT**,2: Utilisation de ChatGPT sans référence,"s'il n'y a pas de référence, j'utiliserai pas",Lau4_segment_12.txt
LAU4,2: **Enjeux éthiques et usage de ChatGPT**,3: Importance de citer les sources,"même si je ne peux pas mettre de note de bas de page, c'est embêtant quand même",Lau4_segment_12.txt
LAU4,2: **Enjeux éthiques et usage de ChatGPT**,4: Recherche de sources originales,"si c'est facile de retrouver sur internet, je le ferais sans doute, d'aller chercher la source",Lau4_segment_12.txt
LAU4,2: **Enjeux éthiques et usage de ChatGPT**,5: Impact sur l'apprentissage,ça m'évite de faire ce travail qui me semble difficile,Lau4_segment_12.txt
LAU4,2: **Enjeux éthiques et usage de ChatGPT**,6: Positionnement éthique personnel,je ne serais pas tellement en confiance,Lau4_segment_12.txt
LAU4,2: **Enjeux éthiques et usage de ChatGPT**,7: Éthique académique,tu reprends entre guillemets presque le travail de quelqu'un d'autre,Lau4_segment_12.txt
LAU4,2: **Enjeux éthiques et usage de ChatGPT**,8: Utilisation responsable,j'utiliserai pas sans référence,Lau4_segment_12.txt
LAU4,2: **Enjeux éthiques et usage de ChatGPT**,9: Facilité d'utilisation,c'est une solution de facilité,Lau4_segment_12.txt
LAU4,2: **Enjeux éthiques et usage de ChatGPT**,10: Conscience des limites,ça m'évite un temps que j'aurais consacré,Lau4_segment_12.txt
LAU4,3: **Impact de ChatGPT sur l'apprentissage et le temps**,1: Gain de temps avec ChatGPT,"on a beaucoup parlé du gain de temps, ou en tout cas de la relation au temps avec ChatGPT",Lau4_segment_12.txt
LAU4,3: **Impact de ChatGPT sur l'apprentissage et le temps**,2: Effet sur l'apprentissage personnel,Est-ce qu'il y a un lien entre la notion du temps avec mon activité et mon apprentissage ?,Lau4_segment_12.txt
LAU4,3: **Impact de ChatGPT sur l'apprentissage et le temps**,3: Rôle dans la reformulation,"Même pour la reformulation, je pense qu'on peut en parler",Lau4_segment_12.txt
LAU4,3: **Impact de ChatGPT sur l'apprentissage et le temps**,4: Développement des compétences,"si tu le reformules toi-même, tu vas plutôt apprendre à reformuler toi tes phrases",Lau4_segment_12.txt
LAU4,3: **Impact de ChatGPT sur l'apprentissage et le temps**,5: Risque de perte d'apprentissage,"alors que si tu laisses faire ChatGPT, finalement, tu vas peut-être, disons, perdre cet apprentissage",Lau4_segment_12.txt
LAU4,3: **Impact de ChatGPT sur l'apprentissage et le temps**,6: Utilisation de ChatGPT pour la reformulation,c'est surtout des questions de reformulation,Lau4_segment_12.txt
LAU4,3: **Impact de ChatGPT sur l'apprentissage et le temps**,7: Effet sur l'écriture académique,développer une nouvelle façon d’aiguiser ton écriture académique,Lau4_segment_12.txt
LAU4,3: **Impact de ChatGPT sur l'apprentissage et le temps**,10: Impact sur la qualité du contenu,"est-ce que tu sens qu'il y a une différence peut-être, alors j'allais dire d'amélioration",Lau4_segment_12.txt
LAU4,4: **Attitude envers les règles académiques et ChatGPT**,2: Utilisation de ChatGPT et normes académiques,j'utiliserai pas s'il n'y a pas de référence,Lau4_segment_12.txt
LAU4,4: **Attitude envers les règles académiques et ChatGPT**,4: Adaptation aux nouvelles technologies,on a tendance à plutôt ne pas le mentionner [ChatGPT],Lau4_segment_12.txt
LAU4,4: **Attitude envers les règles académiques et ChatGPT**,5: Évolution de la perception de ChatGPT,Est-ce que tu penses que ça va peut-être évoluer au fil du temps ?,Lau4_segment_12.txt
LAU4,4: **Attitude envers les règles académiques et ChatGPT**,6: Rigueur académique,tu restes un petit peu proche des règles académiques,Lau4_segment_12.txt
LAU4,4: **Attitude envers les règles académiques et ChatGPT**,7: Perception de l'évolution,ça va peut-être évoluer,Lau4_segment_12.txt
LAU4,4: **Attitude envers les règles académiques et ChatGPT**,8: Flexibilité dans l'utilisation,"je le ferais sans doute, d'aller chercher la source",Lau4_segment_12.txt
LAU4,4: **Attitude envers les règles académiques et ChatGPT**,9: Conformité aux normes,je ne serais pas contre citer Wikipédia s'il y a des personnes précisément,Lau4_segment_12.txt
LAU4,5: **Évolution et acceptation de ChatGPT**,4: Impact sur les pratiques académiques,"tu vas peut-être, disons, perdre cet apprentissage",Lau4_segment_12.txt
LAU4,5: **Évolution et acceptation de ChatGPT**,7: Intégration progressive,on a beaucoup parlé du gain de temps,Lau4_segment_12.txt
LAU4,1: Perception de l'usage de ChatGPT dans le travail académique,1: Utilité de ChatGPT,c'est justement ce qui me fait gagner du temps,Lau4_segment_13.txt
LAU4,1: Perception de l'usage de ChatGPT dans le travail académique,2: Qualité du travail,le texte sera moins bon,Lau4_segment_13.txt
LAU4,1: Perception de l'usage de ChatGPT dans le travail académique,3: Compensation pour les limitations,je cherche à l'améliorer,Lau4_segment_13.txt
LAU4,1: Perception de l'usage de ChatGPT dans le travail académique,4: Alternative à ChatGPT,"je ne vais pas rendre ça, de toute façon je vais faire l'effort de relire moins",Lau4_segment_13.txt
LAU4,1: Perception de l'usage de ChatGPT dans le travail académique,5: Auto-évaluation,je pense que j'arrive de toute façon à arriver à ce que je veux quand même avec ou sans Chat GPT,Lau4_segment_13.txt
LAU4,1: Perception de l'usage de ChatGPT dans le travail académique,6: Gain de temps,ce qui me fait gagner du temps,Lau4_segment_13.txt
LAU4,1: Perception de l'usage de ChatGPT dans le travail académique,7: Comparaison avec un travail sans ChatGPT,si je n'utilise pas ChatGPT,Lau4_segment_13.txt
LAU4,1: Perception de l'usage de ChatGPT dans le travail académique,8: Impact sur la qualité du travail,pas la même qualité qu'un texte finalisé par moi uniquement,Lau4_segment_13.txt
LAU4,1: Perception de l'usage de ChatGPT dans le travail académique,9: Satisfaction,j'en suis bien contente,Lau4_segment_13.txt
LAU4,1: Perception de l'usage de ChatGPT dans le travail académique,10: Adaptation,je vais faire l'effort de relire moins,Lau4_segment_13.txt
LAU4,2: Rôle de ChatGPT dans la compréhension des tâches académiques,1: Perception du rôle de ChatGPT,Ça ne joue pas vraiment de rôle là-dessus,Lau4_segment_13.txt
LAU4,2: Rôle de ChatGPT dans la compréhension des tâches académiques,2: Compétences académiques,Mes capacités académiques... restent les mêmes,Lau4_segment_13.txt
LAU4,2: Rôle de ChatGPT dans la compréhension des tâches académiques,3: Utilité perçue,"c'est vraiment du confort, mais qui n'est pas lié à mes compétences",Lau4_segment_13.txt
LAU4,2: Rôle de ChatGPT dans la compréhension des tâches académiques,4: Facilitation,pour m'éviter une capacité... qui me demande plus d'effort,Lau4_segment_13.txt
LAU4,2: Rôle de ChatGPT dans la compréhension des tâches académiques,5: Auto-évaluation des compétences,je sais que je peux m'en passer,Lau4_segment_13.txt
LAU4,2: Rôle de ChatGPT dans la compréhension des tâches académiques,6: Distinction entre confort et compétence,"c'est un plus, c'est vraiment du confort",Lau4_segment_13.txt
LAU4,2: Rôle de ChatGPT dans la compréhension des tâches académiques,7: Impact sur les compétences,je n'ai pas l'impression que ça influence mes capacités académiques,Lau4_segment_13.txt
LAU4,2: Rôle de ChatGPT dans la compréhension des tâches académiques,8: Utilisation comme outil,quand je dis que c'est un plus,Lau4_segment_13.txt
LAU4,2: Rôle de ChatGPT dans la compréhension des tâches académiques,9: Limitations reconnues,je ne sais pas si je m'explique clairement,Lau4_segment_13.txt
LAU4,2: Rôle de ChatGPT dans la compréhension des tâches académiques,10: Perception de l'aide,c'est une... Comment dire ? une capacité académique qui me demande plus d'effort,Lau4_segment_13.txt
LAU4,3: Formation académique et utilisation de ChatGPT,1: Acquisition des compétences avant ChatGPT,j'ai quand même cette impression d'avoir acquis mes compétences académiques sans aide,Lau4_segment_13.txt
LAU4,3: Formation académique et utilisation de ChatGPT,2: Utilisation de ChatGPT en master,en master j'ai découvert que ça pouvait m'aider,Lau4_segment_13.txt
LAU4,3: Formation académique et utilisation de ChatGPT,3: Complémentarité de ChatGPT,mais pas remplacer un apprentissage de l'université,Lau4_segment_13.txt
LAU4,3: Formation académique et utilisation de ChatGPT,4: Perception de la formation,ma formation s'est faite sans,Lau4_segment_13.txt
LAU4,3: Formation académique et utilisation de ChatGPT,5: Valeur ajoutée de ChatGPT,ça pouvait m'aider,Lau4_segment_13.txt
LAU4,3: Formation académique et utilisation de ChatGPT,6: Limite de ChatGPT,pas remplacer un apprentissage de l'université,Lau4_segment_13.txt
LAU4,3: Formation académique et utilisation de ChatGPT,7: Précédent académique,ayant fait tout mon bachelor sans,Lau4_segment_13.txt
LAU4,3: Formation académique et utilisation de ChatGPT,8: Évolution de l'usage,j'ai découvert que ça pouvait m'aider,Lau4_segment_13.txt
LAU4,3: Formation académique et utilisation de ChatGPT,9: Complémentarité,"m'aider, mais pas remplacer",Lau4_segment_13.txt
LAU4,3: Formation académique et utilisation de ChatGPT,10: Perception de l'apprentissage,j'ai acquis mes compétences académiques sans aide,Lau4_segment_13.txt
LAU4,4: Évaluation de l'impact de ChatGPT sur le parcours académique,1: Évaluation globale,je pense avoir quand même compris les bases de ce qu'on attend à l'université,Lau4_segment_13.txt
LAU4,4: Évaluation de l'impact de ChatGPT sur le parcours académique,2: Auto-évaluation positive,je pense avoir compris sans ces trucs-là,Lau4_segment_13.txt
LAU4,4: Évaluation de l'impact de ChatGPT sur le parcours académique,3: Perception de l'indépendance,ayant acquis mes compétences académiques sans aide,Lau4_segment_13.txt
LAU4,4: Évaluation de l'impact de ChatGPT sur le parcours académique,5: Perception de la formation comme non terminée,"Ma formation, elle n'est pas terminée",Lau4_segment_13.txt
LAU4,4: Évaluation de l'impact de ChatGPT sur le parcours académique,8: Compréhension des attentes universitaires,j'ai compris les bases de ce qu'on attend à l'université,Lau4_segment_13.txt
LAU4,5: Manière d'utiliser ChatGPT dans le processus de travail,1: Moment d'utilisation,en fin de travail,Lau4_segment_13.txt
LAU4,5: Manière d'utiliser ChatGPT dans le processus de travail,2: Usage pour la relecture,notamment pour tes relectures,Lau4_segment_13.txt
LAU4,5: Manière d'utiliser ChatGPT dans le processus de travail,3: Utilisation en amont,"soit avant de travailler, soit au tout début",Lau4_segment_13.txt
LAU4,5: Manière d'utiliser ChatGPT dans le processus de travail,4: Usage spécifique pour la reformulation,"tu pourrais directement ne pas utiliser Chat GPT, toi même reformuler",Lau4_segment_13.txt
LAU4,5: Manière d'utiliser ChatGPT dans le processus de travail,9: Perception de l'outil,c'est un plus,Lau4_segment_13.txt
LAU4,1: Perception et utilisation de ChatGPT,1: Utilisation réfléchie,ça me fait aussi réfléchir à ma propre utilisation,Lau4_segment_16.txt
LAU4,1: Perception et utilisation de ChatGPT,2: Prise de conscience de la dépendance,surtout quand tu as parlé de dépendance je pense que c'est pas... je le percevais pas forcément comme ça,Lau4_segment_16.txt
LAU4,1: Perception et utilisation de ChatGPT,3: Utilisation pour la rédaction et la réflexion académique,"comme une manière de présenter ChatGPT comme un outil, savoir ce qui peut être utile pour accompagner un processus de rédaction ou de réflexion académique",Lau4_segment_16.txt
LAU4,1: Perception et utilisation de ChatGPT,4: Réflexion sur l'approche personnelle,Je pense que ça m'amène aussi un peu à préciser mon approche et à mieux définir ce que j'en fais,Lau4_segment_16.txt
LAU4,1: Perception et utilisation de ChatGPT,5: Discussion avec le directeur de recherche,ou dans le cas où je devrais par exemple en discuter avec mon directeur de recherche,Lau4_segment_16.txt
LAU4,2: Intégration de ChatGPT dans le milieu académique,1: Nécessité de formation,Peut-être que des formations ou des...,Lau4_segment_16.txt
LAU4,2: Intégration de ChatGPT dans le milieu académique,2: Discussions dans les cours,tout simplement d'en parler dans les cours dispensés à l'université par les enseignants eux-mêmes,Lau4_segment_16.txt
LAU4,2: Intégration de ChatGPT dans le milieu académique,3: Positionnement des enseignants,si chaque enseignant ou enseignante donne sa position vis-à-vis de ChatGPT,Lau4_segment_16.txt
LAU4,2: Intégration de ChatGPT dans le milieu académique,4: Utilité pour les étudiants,"Ça peut être utile, je pense, pour les étudiantes et les étudiants",Lau4_segment_16.txt
LAU4,2: Intégration de ChatGPT dans le milieu académique,5: Perception des enseignants sur l'utilisation de ChatGPT,des enseignants qui ont aussi eux une idée un peu... de ce que peuvent en faire leurs étudiantes et étudiants,Lau4_segment_16.txt
LAU4,3: Tabou et perception négative de ChatGPT,1: Diabolisation de ChatGPT,ce tabou tend à un petit peu diaboliser presque plus que de raison ce genre d'outils,Lau4_segment_16.txt
LAU4,3: Tabou et perception négative de ChatGPT,2: Perception négative des enseignants,"les personnes qui ne l'utilisent pas, donc quand j'ai des personnes plutôt dans un corps enseignant, ces personnes-là ont peut-être un avis défavorable",Lau4_segment_16.txt
LAU4,3: Tabou et perception négative de ChatGPT,3: Contribution au tabou,ça participe au tabou,Lau4_segment_16.txt
LAU4,3: Tabou et perception négative de ChatGPT,4: Image faussée de l'utilisation de ChatGPT,les profs se font presque une image faussée de comment on l'utilise,Lau4_segment_16.txt
LAU4,3: Tabou et perception négative de ChatGPT,5: Nécessité d'ouvrir le dialogue,"Donc il faudrait ouvrir le dialogue, selon moi, en gros",Lau4_segment_16.txt
LAU4,4: Discours et positionnement sur ChatGPT,1: Discours orientés des professeurs,on aurait aussi des discours un petit peu orientés ?,Lau4_segment_16.txt
LAU4,4: Discours et positionnement sur ChatGPT,2: Influence de la discipline sur la perception,"Si c'est un professeur qui est en informatique comme ça, il aurait peut-être plus de facilité à considérer ces nouveaux objets, disons",Lau4_segment_16.txt
LAU4,4: Discours et positionnement sur ChatGPT,3: Mentionner le positionnement,Peut-être juste mentionner le positionnement du prof vis-à-vis de ça,Lau4_segment_16.txt
LAU4,4: Discours et positionnement sur ChatGPT,4: Variabilité dans l'utilisation,"il y en a certainement dans le tas des étudiants qui utilisent ChatGPT, peut-être de manière abusive... mais il y en a peut-être beaucoup aussi qui l'utilisent de manière... plus occasionnelle",Lau4_segment_16.txt
LAU4,4: Discours et positionnement sur ChatGPT,5: Utilisation modérée,"pas besoin d'en faire beaucoup, mais...",Lau4_segment_16.txt
LAU4,5: Impact sur la pratique académique,1: Impact sur la manière de travailler,concernant ChatGPT et sur ce que ça a eu comme impact sur ta manière de travailler et d'étudier,Lau4_segment_16.txt
LAU4,5: Impact sur la pratique académique,3: Utilisation pour la reformulation,"comme toi, avec les reformulations",Lau4_segment_16.txt
LAU4,5: Impact sur la pratique académique,4: Changement de perspective,ça amène aussi à d'autres réflexions,Lau4_segment_16.txt
LAU4,1: Perception de soi et légitimité dans le travail académique,1: Sentiment d'illégitimité,je pense que c'est aussi vis-à-vis de moi-même pour me sentir légitime en rendant un travail.,Lau4_segment_3.txt
LAU4,1: Perception de soi et légitimité dans le travail académique,2: Préférence pour l'originalité,je pense que je préfère être sûre que toutes les idées viennent de moi,Lau4_segment_3.txt
LAU4,1: Perception de soi et légitimité dans le travail académique,3: Crainte de la détection du manque d'originalité,et que ça ne se voit pas en fait.,Lau4_segment_3.txt
LAU4,1: Perception de soi et légitimité dans le travail académique,4: Impact sur la confiance en soi,pour me sentir légitime en rendant un travail.,Lau4_segment_3.txt
LAU4,1: Perception de soi et légitimité dans le travail académique,5: Auto-exigence d'authenticité,je préfère être sûre que toutes les idées viennent de moi,Lau4_segment_3.txt
LAU4,1: Perception de soi et légitimité dans le travail académique,6: Relation entre originalité et sentiment de compétence,pour me sentir légitime,Lau4_segment_3.txt
LAU4,1: Perception de soi et légitimité dans le travail académique,7: Tabou personnel lié à l'utilisation d'outils externes,c'est aussi vis-à-vis de moi-même,Lau4_segment_3.txt
LAU4,1: Perception de soi et légitimité dans le travail académique,8: Effort pour cacher l'utilisation d'aides externes,que ça ne se voit pas en fait.,Lau4_segment_3.txt
LAU4,1: Perception de soi et légitimité dans le travail académique,9: Normes internes de production intellectuelle,toutes les idées viennent de moi,Lau4_segment_3.txt
LAU4,1: Perception de soi et légitimité dans le travail académique,10: Perception de la nécessité de justifier son travail,me sentir légitime en rendant un travail.,Lau4_segment_3.txt
