Entretien,Thème,Code,Verbatim,Fichier
LAU8,5: Éléments Non Verbaux et Contexte,7: Facteurs externes,non mentionnés,Lau8_segment_17.txt
LAU8,5: Éléments Non Verbaux et Contexte,8: Réactions non verbales,non disponibles,Lau8_segment_17.txt
LAU8,5: Éléments Non Verbaux et Contexte,10: Émotions sous-jacentes,"Euh…"" et ""Merci beaucoup"" pourraient suggérer des émotions sous-jacentes comme la gratitude ou la légère hésitation.",Lau8_segment_17.txt
LAU8,1: Utilisation de ChatGPT pour la compréhension du cours,1: Utilité de ChatGPT pour comprendre les bases,j’étais contente que ChatGPT m’explique un peu les bases,Lau8_segment_8.txt
LAU8,1: Utilisation de ChatGPT pour la compréhension du cours,2: Compréhension des concepts complexes,"revoir des bases ou essayer de comprendre des trucs genre... mais c’est quoi, une structure de données ?",Lau8_segment_8.txt
LAU8,1: Utilisation de ChatGPT pour la compréhension du cours,3: Sentiment de confort avec le sujet,Ça m’a aidée à me sentir un peu plus à l’aise avec le thème,Lau8_segment_8.txt
LAU8,1: Utilisation de ChatGPT pour la compréhension du cours,4: Alternative aux supports de cours,"si j’avais travaillé toute seule avec juste les dias, j’aurais pas su par où commencer",Lau8_segment_8.txt
LAU8,1: Utilisation de ChatGPT pour la compréhension du cours,5: Supplémentarité de ChatGPT,j’y connaissais tellement rien que j’étais contente que ChatGPT m’explique un peu les bases,Lau8_segment_8.txt
LAU8,1: Utilisation de ChatGPT pour la compréhension du cours,6: Facilité d'apprentissage,rendre l’apprentissage un peu plus logique,Lau8_segment_8.txt
LAU8,1: Utilisation de ChatGPT pour la compréhension du cours,7: Besoin de clarification,j’avais l’impression que c’était pas mon domaine,Lau8_segment_8.txt
LAU8,1: Utilisation de ChatGPT pour la compréhension du cours,8: Dépendance à ChatGPT,je sais pas comment j’aurais fait s’il n’y avait pas eu ChatGPT,Lau8_segment_8.txt
LAU8,1: Utilisation de ChatGPT pour la compréhension du cours,9: Nouveauté et adaptation,"tout est nouveau. Avec les choses qu’on voit en digital society, c’est un nouveau thème",Lau8_segment_8.txt
LAU8,1: Utilisation de ChatGPT pour la compréhension du cours,10: Changement dans la méthode de travail,"ça a changé. Parce que, bah, tout est nouveau",Lau8_segment_8.txt
LAU8,2: Interaction avec les professeurs et les pairs,1: Inaccessibilité du professeur,mon prof il est... Enfin le prof de ce cours là il est pas accessible du tout,Lau8_segment_8.txt
LAU8,2: Interaction avec les professeurs et les pairs,2: Manque de temps pour les questions,je me vois pas du tout lui poser des questions. J’ai l’impression qu’il a pas le temps,Lau8_segment_8.txt
LAU8,2: Interaction avec les professeurs et les pairs,3: Contenu dense du cours,"on a genre 5 ou 10 minutes, parce qu’il a trop de contenu à nous donner",Lau8_segment_8.txt
LAU8,2: Interaction avec les professeurs et les pairs,4: Alternatives pour obtenir de l'aide,"j’ai une amie qui fait le master aussi. Elle m’a dit que ce cours-là, il l’a fait en deux heures, mais elle, elle l’a fait en un semestre",Lau8_segment_8.txt
LAU8,2: Interaction avec les professeurs et les pairs,5: Difficulté à demander de l'aide,"je pense que c’est une question de temps. Et puis, je saurais pas vraiment comment poser mes questions",Lau8_segment_8.txt
LAU8,2: Interaction avec les professeurs et les pairs,6: Disponibilité des pairs,j’aurais pu lui demander. Mais je pense qu’elle avait d’autres choses à faire aussi,Lau8_segment_8.txt
LAU8,2: Interaction avec les professeurs et les pairs,7: Présence d'autres ressources,"j’ai aussi mon frère qui est ingénieur en informatique, donc j’aurais pu lui demander",Lau8_segment_8.txt
LAU8,2: Interaction avec les professeurs et les pairs,8: Préférence pour ChatGPT,"je me suis dit, vu que j’ai ChatGPT, je vais utiliser ça",Lau8_segment_8.txt
LAU8,2: Interaction avec les professeurs et les pairs,9: Raisons de ne pas demander de l'aide,faudrait qu’on prenne un vrai moment face à face où je lui explique tout ce que j’ai comme questions,Lau8_segment_8.txt
LAU8,2: Interaction avec les professeurs et les pairs,10: Utilisation de ChatGPT par défaut,"j’ai ChatGPT, je vais utiliser ça. Et si vraiment je comprends rien, là je lui demanderai",Lau8_segment_8.txt
LAU8,3: Perception et limites de ChatGPT,1: Réponses trop détaillées,j’ai l’impression qu’il développe trop,Lau8_segment_8.txt
LAU8,3: Perception et limites de ChatGPT,2: Besoin de réponses concises,"j’ai juste besoin de quelqu’un qui me... au lieu de donner trop d’infos, me synthétise les choses",Lau8_segment_8.txt
LAU8,3: Perception et limites de ChatGPT,3: Sélection de l'information pertinente,"je prends juste ce qui m’intéresse. Et si je vois que finalement il me répond un truc que je savais déjà, ou que je comprends toujours pas, ou que je trouve pas ça utile, bah j’arrête tout simplement de lire",Lau8_segment_8.txt
LAU8,3: Perception et limites de ChatGPT,4: Gestion de la réponse,"des fois, ça m’énerve un peu parce que… Je sais pas si c’est lié à la façon dont je pose mes questions",Lau8_segment_8.txt
LAU8,3: Perception et limites de ChatGPT,5: Utilisation sélective,je ne lisais pas tout ce qu’il me disait,Lau8_segment_8.txt
LAU8,3: Perception et limites de ChatGPT,6: Perception de la qualité de la réponse,je m’en fous un peu de tout ce qu’il raconte parfois,Lau8_segment_8.txt
LAU8,3: Perception et limites de ChatGPT,7: Dépendance à la formulation des questions,"je sais pas si, à un moment, j’ai dit dans une discussion, « donne-moi une réponse courte »",Lau8_segment_8.txt
LAU8,3: Perception et limites de ChatGPT,8: Adaptation à ChatGPT,je lis pas jusqu’à la fin,Lau8_segment_8.txt
LAU8,3: Perception et limites de ChatGPT,9: Satisfaction partielle,je prends juste ce qui m’intéresse,Lau8_segment_8.txt
LAU8,3: Perception et limites de ChatGPT,10: Critique implicite,il va trop dans les détails,Lau8_segment_8.txt
LAU8,4: Impact de ChatGPT sur les habitudes de travail,2: Paresse et dépendance,"je me disais, Clara, tu deviens trop paresseuse",Lau8_segment_8.txt
LAU8,4: Impact de ChatGPT sur les habitudes de travail,3: Réflexion personnelle vs. utilisation de ChatGPT,"je me disais, ah, mais je peux juste laisser ChatGPT réfléchir à ma place quoi",Lau8_segment_8.txt
LAU8,4: Impact de ChatGPT sur les habitudes de travail,4: Manque d'initiative,"j’avais la flemme de les écrire moi-même, je pense",Lau8_segment_8.txt
LAU8,4: Impact de ChatGPT sur les habitudes de travail,5: Réalisation de la dépendance,"souvent, je me rends compte qu’avant, peut-être le semestre dernier ou il y a deux semestres, je me disais, j’ai la flemme de réfléchir",Lau8_segment_8.txt
LAU8,4: Impact de ChatGPT sur les habitudes de travail,6: Préférence pour une réponse directe,je posais mes questions directement à ChatGPT au lieu de creuser par moi-même,Lau8_segment_8.txt
LAU8,4: Impact de ChatGPT sur les habitudes de travail,7: Conscientisation de la nécessité de réfléchir,"je me suis dit, non, là, Clara, stop, tu t’arrêtes, tu réfléchis un peu",Lau8_segment_8.txt
LAU8,4: Impact de ChatGPT sur les habitudes de travail,8: Changement de comportement,"alors que j’aurais pu, moi-même, réfléchir et mettre par écrit",Lau8_segment_8.txt
LAU8,4: Impact de ChatGPT sur les habitudes de travail,9: Reconnaissance de l'utilité de ChatGPT,"il me donnait, par exemple, les rôles des enseignants ou ce genre de trucs",Lau8_segment_8.txt
LAU8,4: Impact de ChatGPT sur les habitudes de travail,10: Équilibre entre utilisation de ChatGPT et réflexion personnelle,je pense que ça avait changé ma manière de réfléchir,Lau8_segment_8.txt
LAU8,5: Contexte du cours et difficultés rencontrées,1: Difficulté du cours,compliqué,Lau8_segment_8.txt
LAU8,5: Contexte du cours et difficultés rencontrées,2: Contenu dense,"c’est large, et j’ai une amie qui fait le master aussi. Elle m’a dit que ce cours-là, il l’a fait en deux heures, mais elle, elle l’a fait en un semestre",Lau8_segment_8.txt
LAU8,5: Contexte du cours et difficultés rencontrées,3: Charge de travail,"c’est hyper condensé. Ouais, c’est pas facile",Lau8_segment_8.txt
LAU8,5: Contexte du cours et difficultés rencontrées,4: Comparaison avec d'autres expériences,"elle m’a dit que ce cours-là, il l’a fait en deux heures, mais elle, elle l’a fait en un semestre",Lau8_segment_8.txt
LAU8,5: Contexte du cours et difficultés rencontrées,5: Perception de la difficulté,"je m’étais dit que je pourrais lui demander, parce qu’elle a déjà fait des cours d’informatique",Lau8_segment_8.txt
LAU8,5: Contexte du cours et difficultés rencontrées,6: Sentiment d'être dépassé,j’ai l’impression que c’était pas mon domaine,Lau8_segment_8.txt
LAU8,5: Contexte du cours et difficultés rencontrées,9: Difficultés à gérer le temps,je pense que c’est une question de temps,Lau8_segment_8.txt
LAU8,5: Contexte du cours et difficultés rencontrées,10: Satisfaction avec les ressources disponibles,j’ai aussi mon frère qui est ingénieur en informatique,Lau8_segment_8.txt
